[
  {
    "nugetId": "uSync",
    "title": "uSync",
    "category": "",
    "githubRepo": "KevinJump/uSync"
  },
  {
    "nugetId": "uSync.Complete",
    "title": "uSync Complete",
    "category": "",
    "githubRepo": "Jumoo/uSync.Complete",
    "issuesRepo": "Jumoo/uSync.Complete.Issues"
  },
  {
    "nugetId": "uSync.Forms",
    "title": "uSync Forms",
    "category": "uSync Addon",
    "githubRepo": "KevinJump/uSync.Forms"
  },
  {
    "nugetId": "uSync.Umbraco.Commerce",
    "title": "uSync Commerce",
    "category": "uSync Addon",
    "githubRepo": "Jumoo/uSync.Umbraco.Commerce"
  },
  {
    "nugetId": "uSync.Cli",
    "title": "uSync CLI",
    "category": "uSync Addon",
    "githubRepo": "Jumoo/uSync.CommandLine"
  },
  {
    "nugetId": "uSync.Migrations",
    "title": "uSync Migrations",
    "category": "uSync Addon",
    "githubRepo": "Jumoo/uSyncMigrations"
  },
  {
    "nugetId": "uSync.Hangfire",
    "title": "uSync Hangfire",
    "category": "uSync Addon",
    "githubRepo": "Jumoo/uSync.Hangfire"
  },
  {
    "nugetId": "uSync.AI",
    "title": "uSync AI",
    "category": "uSync Addon",
    "githubRepo": "Jumoo/uSync.AI"
  },
  {
    "nugetId": "uSync.Engage",
    "title": "uSync Engage",
    "category": "uSync Addon",
    "githubRepo": "Jumoo/uSync.Engage"
  },
  {
    "nugetId": "Jumoo.TranslationManager",
    "title": "Translation Manager",
    "category": "",
    "githubRepo": "Jumoo/Jumoo.TranslationManager",
    "issuesRepo": "Jumoo/Jumoo.TranslationManager.Issues"
  },
  {
    "nugetId": "Jumoo.TranslationManager.AI",
    "title": "AI Connector",
    "category": "Translation Connectors",
    "githubRepo": "Jumoo/Jumoo.TranslationManager.AI"
  },
  {
    "nugetId": "Jumoo.TranslationManager.CSV",
    "title": "CSV Connector",
    "category": "Translation Connectors",
    "githubRepo": "Jumoo/Jumoo.TranslationManager.CSV"
  },
  {
    "nugetId": "Jumoo.TranslationManager.UmbracoAI",
    "title": "UmbracoAI Connector",
    "category": "Translation Connectors",
    "githubRepo": "Jumoo/Jumoo.TranslationManager.UmbracoAI"
  },
  {
    "nugetId": "Jumoo.TranslationManager.SmartCat",
    "title": "SmartCat Connector",
    "category": "Translation Connectors",
    "githubRepo": "Jumoo/Jumoo.TranslationManager.SmartCat"
  },
  {
    "nugetId": "Jumoo.TranslationManager.Publicis",
    "aliasNugetIds": [
      "Jumoo.TranslationManager.Providers.TranslatePlus",
      "Jumoo.TranslationManager.TranslatePlus"
    ],
    "title": "Publicis Connector",
    "category": "Translation Connectors",
    "githubRepo": "Jumoo/TranslatePlus-Connector"
  },
  {
    "nugetId": "Jumoo.TranslationManager.DeepL",
    "aliasNugetIds": ["Jumoo.TranslationManager.Connector.DeepL"],
    "title": "DeepL Connector",
    "category": "Translation Connectors",
    "githubRepo": "Jumoo/Jumoo.TranslationManager.Connector.DeepL"
  },
  {
    "nugetId": "Jumoo.TranslationManager.Google",
    "aliasNugetIds": [
      "Jumoo.TranslationManager.Connector.Google",
      "Jumoo.TranslationManager.Providers.Google"
    ],
    "title": "Google Connector",
    "category": "Translation Connectors",
    "githubRepo": "Jumoo/Google.Connector"
  },
  {
    "nugetId": "Jumoo.TranslationManager.Xliff",
    "aliasNugetIds": [
      "Jumoo.TranslationManager.Connector.Xliff",
      "Jumoo.TranslationManager.Providers.Xliff"
    ],
    "title": "Xliff Connector",
    "category": "Translation Connectors",
    "githubRepo": "Jumoo/Xliff.Connector"
  },
  {
    "nugetId": "Jumoo.TranslationManager.Microsoft",
    "aliasNugetIds": [
      "Jumoo.TranslationManager.Connector.Microsoft",
      "Jumoo.TranslationManager.Providers.Microsoft"
    ],
    "title": "Microsoft Connector",
    "category": "Translation Connectors",
    "githubRepo": "Jumoo/Microsoft.Connector"
  },
  {
    "nugetId": "Jumoo.TranslationManager.Passthrough",
    "aliasNugetIds": ["Jumoo.TranslationManager.Connector.Passthrough"],
    "title": "Passthrough Connector",
    "category": "Translation Connectors",
    "githubRepo": "Jumoo/Passthrough.Connector"
  },
  {
    "nugetId": "Jumoo.TranslationManager.CrowdIn",
    "title": "CrowdIn Connector",
    "category": "Translation Connectors",
    "githubRepo": "Jumoo/Jumoo.TranslationManager.CrowdIn"
  },
  {
    "nugetId": "Jumoo.TranslationManager.LanguageWire",
    "title": "LanguageWire Connector",
    "category": "Translation Connectors",
    "githubRepo": "Jumoo/LanguageWire.Connector"
  },
  {
    "nugetId": "Jumoo.TranslationManager.GlobalLink",
    "aliasNugetIds": ["Jumoo.TranslationManager.Connectors.GlobalLink"],
    "title": "GlobalLink Connector",
    "category": "Translation Connectors",
    "githubRepo": "Jumoo/Jumoo.TranslationManager.GlobalLink"
  },
  {
    "nugetId": "Umbraco.Community.LinkedPages",
    "title": "Linked Pages",
    "category": "Other",
    "githubRepo": "Jumoo/Our.Umbraco.LinkedPages"
  },
  {
    "nugetId": "Our.Umbraco.MaintenanceMode",
    "title": "Maintenance Mode",
    "category": "Other",
    "githubRepo": "Jumoo/Our.Umbraco.MaintenanceMode"
  },
  {
    "nugetId": "uSync.Automate",
    "title": "uSync Automate",
    "category": "uSync.Automate Extensions",
    "githubRepo": "Jumoo/uSync.Automate"
  },
  {
    "nugetId": "Jumoo.TranslationManager.Automate",
    "title": "Translation Manager Automate",
    "category": "uSync.Automate Extensions",
    "githubRepo": "Jumoo/Jumoo.TranslationManager.Automate"
  },
  {
    "nugetId": "Umbraco.Community.PowerToys",
    "title": "PowerToys",
    "category": "Other",
    "githubRepo": "Jumoo/umbraco.community.powertoys"
  },
  {
    "nugetId": "Jumoo.Processing",
    "title": "Jumoo.Processing",
    "category": "Other",
    "githubRepo": "Jumoo/Jumoo.Processing"
  },
  {
    "nugetId": "Jumoo.Json",
    "title": "Jumoo.Json",
    "category": "Other",
    "githubRepo": "Jumoo/Jumoo.Json"
  }
]
